{
    "chapterid": 4,
    "namespace": "core",
    "formatversion": 1,
    "title": "Data processing and curation",
    "questions" :
    [
	{
	    "questionid": 1, "type": "choice",
	    "title": "Workflow development",
	    "text": "It is likely that you will be developing or modifying the workflow for data processing. There are a lot of aspects of this workflow that can play a role in your data management, such as the use of an existing work flow engine, the use of existing software vs development of new components, and whether every run needs human intervention or whether all data processing can be run in bulk once the work flow has been defined.",
	    "answers": 
	    [ 
		{   "id": 0, "label": "Taken care of", "responsetype": "ok" },
		{   "id": 1, "label": "Drill deeper", "responsetype": "followup" }
	    ]
	},
	{
	    "questionid": 2, "type": "choice",
	    "title": "How will you make sure to know what exactly has been run?",
	    "answers": 
	    [ 
		{   "id": 0, "label": "Taken care of", "responsetype": "ok" },
		{   "id": 1, "label": "Drill deeper", "responsetype": "followup" }
	    ]
	},
	{
	    "questionid": 3, "type": "choice",
	    "title": "How will you validate the integrity of the results?",
	    "answers": 
	    [ 
		{   "id": 0, "label": "Taken care of", "responsetype": "ok" },
		{   "id": 1, "label": "Drill deeper", "responsetype": "followup" }
	    ]
	},
	{
	    "questionid": 4, "type": "choice",
	    "title": "Do you have a contingency plan?",
	    "text": "What will you do if the compute facility is down?",
	    "answers": 
	    [ 
		{   "id": 0, "label": "Wait", "responsetype": "ok" },
		{   "id": 1, "label": "We have an alternative", "responsetype": "ok" }
	    ]
	}
    ]
}

